<?xml version="1.0" encoding="UTF-8"?>
<!-- Copyright FUJITSU LIMITED 2017-->
 
<tns:TechnicalServices xmlns:xsi="http://www.w3.org/2001/XMLSchema-instance"
  xsi:schemaLocation="oscm.serviceprovisioning/1.9/TechnicalService.xsd ../../oscm-serviceprovisioning/javares/TechnicalServices.xsd"
  xmlns:tns="oscm.serviceprovisioning/1.9/TechnicalService.xsd">
  <tns:TechnicalService accessType="DIRECT" allowingOnBehalfActing="false" baseUrl="not_required"
    build="08.08.2012" id="VMware" loginPath="/Dynamically provided by the IaaS-system" onlyOneSubscriptionPerUser="false"
    provisioningType="ASYNCHRONOUS" provisioningUrl="http://127.0.0.1:8080/ProvisioningService/ProvisioningServiceProxyBean?wsdl"
    provisioningVersion="1.0">
    <AccessInfo locale="en" >VMware Access Info.</AccessInfo>
    <LocalizedDescription locale="de">VMware IaaS Implementierung.</LocalizedDescription>
    <LocalizedDescription locale="en">VMware IaaS implementation.</LocalizedDescription>
    <LocalizedLicense locale="en" />
    <LocalizedTag locale="en">virtual server</LocalizedTag>
    <LocalizedTag locale="en">linux</LocalizedTag>
    <LocalizedTag locale="en">windows 7</LocalizedTag>
    <LocalizedTag locale="en">centos</LocalizedTag>
    <ParameterDefinition configurable="true" default="estess([a-z0-9]){6,8}" id="VMW_INSTANCENAME_PATTERN"
      mandatory="true" valueType="STRING">
      <LocalizedDescription locale="en">Validation pattern for instance name (regex)</LocalizedDescription>
    </ParameterDefinition>
    <ParameterDefinition configurable="true" default="estess" id="VMW_INSTANCENAME_PREFIX"
      mandatory="false" valueType="STRING">
      <LocalizedDescription locale="en">Automatic prepended prefix for the instance name</LocalizedDescription>
    </ParameterDefinition>
    <ParameterDefinition configurable="true" id="VMW_INSTANCENAME" mandatory="true" valueType="STRING">
      <LocalizedDescription locale="de">Name der Instanz</LocalizedDescription>
      <LocalizedDescription locale="en">Instance name</LocalizedDescription>
    </ParameterDefinition>
    <ParameterDefinition configurable="true" default="centos6x64tpl" id="VMW_TEMPLATENAME"
      mandatory="true" valueType="STRING">
      <LocalizedDescription locale="de">Name des VMware-Templates</LocalizedDescription>
      <LocalizedDescription locale="en">VMware template name</LocalizedDescription>
    </ParameterDefinition>
    <ParameterDefinition configurable="true" id="VMW_INSTANCEPARAM" mandatory="false" valueType="STRING">
      <LocalizedDescription locale="de">VMware Konfigurationsparameter</LocalizedDescription>
      <LocalizedDescription locale="en">VMware configuration parameters</LocalizedDescription>
    </ParameterDefinition>
    <ParameterDefinition configurable="true" id="VMW_MAIL_FOR_COMPLETION" mandatory="false"
      valueType="STRING">
      <LocalizedDescription locale="en">Defines whether manual steps are required before activation the
        deployment for the customer.</LocalizedDescription>
    </ParameterDefinition>
    <ParameterDefinition configurable="true" default="1" id="VMW_CPU" mandatory="true" valueType="ENUMERATION">
      <Options>
        <Option id="1">
          <LocalizedOption locale="en">1</LocalizedOption>
        </Option>
        <Option id="2">
          <LocalizedOption locale="en">2</LocalizedOption>
        </Option>
        <Option id="3">
          <LocalizedOption locale="en">3</LocalizedOption>
        </Option>
        <Option id="4">
          <LocalizedOption locale="en">4</LocalizedOption>
        </Option>
      </Options>
      <LocalizedDescription locale="de">Anzahl CPUs</LocalizedDescription>
      <LocalizedDescription locale="en">Number of CPUs</LocalizedDescription>
    </ParameterDefinition>
    <ParameterDefinition configurable="true" default="512" id="VMW_RAM" mandatory="true" valueType="ENUMERATION">
      <Options>
        <Option id="256">
          <LocalizedOption locale="en">256 MB</LocalizedOption>
        </Option>
        <Option id="512">
          <LocalizedOption locale="en">512 MB</LocalizedOption>
        </Option>
        <Option id="1024">
          <LocalizedOption locale="en">1 GB</LocalizedOption>
        </Option>
        <Option id="2048">
          <LocalizedOption locale="en">2 GB</LocalizedOption>
        </Option>
        <Option id="3072">
          <LocalizedOption locale="en">3 GB</LocalizedOption>
        </Option>
        <Option id="4096">
          <LocalizedOption locale="en">4 GB</LocalizedOption>
        </Option>
      </Options>
      <LocalizedDescription locale="de">RAM size</LocalizedDescription>
      <LocalizedDescription locale="en">RAM-Groesse</LocalizedDescription>
    </ParameterDefinition>
    <ParameterDefinition configurable="false" default="11000" id="IAASPROXY_BSS_USER" mandatory="true"
      valueType="STRING">
      <LocalizedDescription locale="en">The user key to be used for service calls to BSS.</LocalizedDescription>
    </ParameterDefinition>
    <ParameterDefinition configurable="false" default="et62i8wof9ah" id="IAASPROXY_BSS_USER_PWD"
      mandatory="true" valueType="STRING">
      <LocalizedDescription locale="en">The password of the user to be used for service calls to BSS</LocalizedDescription>
    </ParameterDefinition>
  </tns:TechnicalService>
</tns:TechnicalServices>