<?xml version='1.0' encoding='UTF-8'?>
<!-- Copyright FUJITSU LIMITED 2016-->
 
<tns:TechnicalServices 
  xmlns:tns="oscm.serviceprovisioning/1.9/TechnicalService.xsd" 
  xmlns:xsi="http://www.w3.org/2001/XMLSchema-instance"
  xsi:schemaLocation="oscm.serviceprovisioning/1.9/TechnicalService.xsd ../../oscm-serviceprovisioning/javares/TechnicalServices.xsd">

  <tns:TechnicalService id="EmptyLocales" build="23.10.2009"
    provisioningType="SYNCHRONOUS"
    provisioningUrl="@techService.http.baseurl@/example-service/services/ProvisioningService?wsdl"
    provisioningVersion="1.0"
    accessType="LOGIN" 
    baseUrl="@techService.http.baseurl@/example-service" 
    loginPath="/login"
    >
    <LocalizedDescription>TestLocalizedDescription</LocalizedDescription>
    <LocalizedLicense>TestLocalizedLicense</LocalizedLicense>
    <ParameterDefinition id="MEMORY_STORAGE" valueType="ENUMERATION" default="1">
             <Options>           
               <Option id="1">
                    <LocalizedOption>TestLocalizedOption</LocalizedOption>
               </Option>            
             </Options>
             <LocalizedDescription locale="en">new Incremental memory storage </LocalizedDescription>
    </ParameterDefinition>

    <Role id="GUEST">
      <LocalizedName>TestLocalizedName</LocalizedName>
      <LocalizedDescription locale="en">new Guests only have limited read access.</LocalizedDescription>
    </Role>
  </tns:TechnicalService>

</tns:TechnicalServices>

