<?xml version='1.0' encoding='UTF-8'?>
<!-- Copyright FUJITSU LIMITED 2017-->
 
<tns:TechnicalServices xmlns:tns="oscm.serviceprovisioning/1.9/TechnicalService.xsd"
  xmlns:xsi="http://www.w3.org/2001/XMLSchema-instance"
  xsi:schemaLocation="oscm.serviceprovisioning/1.9/TechnicalService.xsd ../../oscm-serviceprovisioning/javares/TechnicalServices.xsd">
  <tns:TechnicalService id="Example 1.00" build="18.11.2010" provisioningType="SYNCHRONOUS"
    provisioningUrl="@techService.https.baseurl@/oscm-integrationtests-mockproduct/ProvisioningService?wsdl"
    provisioningVersion="1.0" provisioningUsername="admin" provisioningPassword="adminadmin" accessType="LOGIN"
    baseUrl="@techService.http.baseurl@/oscm-integrationtests-mockproduct" loginPath="/login">
    <LocalizedDescription locale="en">Just a mock service.</LocalizedDescription>
    <LocalizedLicense locale="en">THIS SOFTWARE IS PROVIDED BY THE COPYRIGHT HOLDERS AND CONTRIBUTORS "AS
      IS" AND ANY EXPRESS OR IMPLIED WARRANTIES, INCLUDING, BUT NOT LIMITED TO, THE IMPLIED WARRANTIES OF
      MERCHANTABILITY AND FITNESS FOR A PARTICULAR PURPOSE ARE DISCLAIMED. IN NO EVENT SHALLMOCK INC. BE LIABLE FOR ANY
      DIRECT, INDIRECT, INCIDENTAL, SPECIAL, EXEMPLARY, OR CONSEQUENTIAL DAMAGES (INCLUDING, BUT NOT LIMITED TO,
      PROCUREMENT OF SUBSTITUTE GOODS OR SERVICES; LOSS OF USE, DATA, OR PROFITS; OR BUSINESS INTERRUPTION) HOWEVER
      CAUSED AND ON ANY THEORY OF LIABILITY, WHETHER IN CONTRACT, STRICT LIABILITY, OR TORT (INCLUDING NEGLIGENCE OR
      OTHERWISE) ARISING IN ANY WAY OUT OF THE USE OF THIS SOFTWARE, EVEN IF ADVISED OF THE POSSIBILITY OF SUCH DAMAGE.</LocalizedLicense>
    <ParameterDefinition id="MEMORY_STORAGE" valueType="ENUMERATION" default="2">
      <Options>
        <Option id="1">
          <LocalizedOption locale="en">Minimum Storage (1GB)</LocalizedOption>
        </Option>
        <Option id="2">
          <LocalizedOption locale="en">Optimum storage (2GB)</LocalizedOption>
        </Option>
        <Option id="3">
          <LocalizedOption locale="en">Maximum storage (4GB)</LocalizedOption>
        </Option>
      </Options>
      <LocalizedDescription locale="en">Incremental memory storage </LocalizedDescription>
    </ParameterDefinition>
    <ParameterDefinition id="DISK_SPACE" valueType="ENUMERATION">
      <Options>
        <Option id="1">
          <LocalizedOption locale="en">Minimum Storage (100GB)</LocalizedOption>
        </Option>
        <Option id="2">
          <LocalizedOption locale="en">Optimum storage (200GB)</LocalizedOption>
        </Option>
        <Option id="3">
          <LocalizedOption locale="en">Maximum storage (400GB)</LocalizedOption>
        </Option>
      </Options>
      <LocalizedDescription locale="en">Incremental disk storage</LocalizedDescription>
    </ParameterDefinition>
    <ParameterDefinition id="MAX_FOLDER_NUMBER2" valueType="INTEGER" mandatory="true" configurable="true"
      minValue="12" maxValue="500" default="200">
      <LocalizedDescription locale="en"> Number2 of folders that can be created.</LocalizedDescription>
    </ParameterDefinition>
    <ParameterDefinition id="STRING_DATA_TYPE" valueType="STRING" mandatory="false" configurable="true"
      default="">
      <LocalizedDescription locale="en"> Number2 of folders that can be created.</LocalizedDescription>
    </ParameterDefinition>
    <ParameterDefinition id="MAX_FILE_NUMBER" valueType="INTEGER" mandatory="false" configurable="true"
      minValue="12" maxValue="500" default="200">
      <LocalizedDescription locale="en">Number of files that can be uploaded.</LocalizedDescription>
    </ParameterDefinition>
    <ParameterDefinition id="MAX_FOLDER_NUMBER" valueType="INTEGER" mandatory="false" configurable="true"
      minValue="12" maxValue="500" default="200">
      <LocalizedDescription locale="en">Number of folders that can be created.</LocalizedDescription>
    </ParameterDefinition>
    <ParameterDefinition id="NON_CONFIGURABLE" valueType="INTEGER" mandatory="false" configurable="false"
      minValue="12" maxValue="500" default="200">
      <LocalizedDescription locale="en">Cannot be configured</LocalizedDescription>
    </ParameterDefinition>
    <ParameterDefinition id="RENAME_FOLDER" valueType="BOOLEAN" default="true">
      <LocalizedDescription locale="en">Rename any user folder</LocalizedDescription>
    </ParameterDefinition>
    <ParameterDefinition id="WS_SLEEP" valueType="INTEGER" mandatory="false" minValue="0" maxValue="1200000"
      default="0">
      <LocalizedDescription locale="en"> Defines the time interval to wait befor an outgoing webservice
        of ProvisioningService.createUsers call will be executed. </LocalizedDescription>
    </ParameterDefinition>
  </tns:TechnicalService>
</tns:TechnicalServices>