<?xml version="1.0" encoding="UTF-8"?>
<!-- Copyright FUJITSU LIMITED 2017-->
 
<tns:TechnicalServices xmlns:xsi="http://www.w3.org/2001/XMLSchema-instance"
  xsi:schemaLocation="oscm.serviceprovisioning/1.9/TechnicalService.xsd ../../oscm-serviceprovisioning/javares/TechnicalServices.xsd"
  xmlns:tns="oscm.serviceprovisioning/1.9/TechnicalService.xsd">

  <tns:TechnicalService accessType="DIRECT" allowingOnBehalfActing="false" baseUrl="not_required"
    build="26.03.2013" id="ROR_VirtualPlatform" loginPath="/Dynamically provided by the IaaS-system"
    onlyOneSubscriptionPerUser="false" provisioningType="ASYNCHRONOUS"
    provisioningUrl="^APP_BASE_URL^" provisioningVersion="1.0">

    <AccessInfo locale="en" >Description of how to access the application.</AccessInfo>
    <AccessInfo locale="ja" />
    <LocalizedDescription locale="en">ROR IaaS implementation.</LocalizedDescription>
    <LocalizedDescription locale="ja">ROR IaaS の実装</LocalizedDescription>
    <LocalizedLicense locale="en" />
    <LocalizedLicense locale="ja" />
    <LocalizedTag locale="en">private cloud</LocalizedTag>
    <LocalizedTag locale="en">windows</LocalizedTag>
    <LocalizedTag locale="en">centos</LocalizedTag>
    <LocalizedTag locale="en">fujitsu cloud</LocalizedTag>
    <LocalizedTag locale="en">ror</LocalizedTag>
    <LocalizedTag locale="ja">プライベート・クラウド</LocalizedTag>
    <LocalizedTag locale="ja">windows</LocalizedTag>
    <LocalizedTag locale="ja">centos</LocalizedTag>
    <LocalizedTag locale="ja">富士通クラウド</LocalizedTag>
    <LocalizedTag locale="ja">ror</LocalizedTag>

    <ParameterDefinition configurable="false" default="ess.ror" id="APP_CONTROLLER_ID" mandatory="true"
      valueType="STRING">
      <LocalizedDescription locale="en">The ID of the APP sample service controller.</LocalizedDescription>
      <LocalizedDescription locale="ja">APPサンプル・サービス・コントローラーのID</LocalizedDescription>
    </ParameterDefinition>

    <ParameterDefinition configurable="false" default="^userKey^" id="APP_BSS_USER" mandatory="true"
      valueType="STRING">
      <LocalizedDescription locale="en">The user key of the technology manager to be used for service calls to
        OSCM.</LocalizedDescription>
      <LocalizedDescription locale="ja">OSCMのサービスを呼び出す際に利用する技術サービス管理者の利用者キー</LocalizedDescription>
    </ParameterDefinition>

    <ParameterDefinition configurable="false" default="secret" id="APP_BSS_USER_PWD" mandatory="true"
      valueType="STRING">
      <LocalizedDescription locale="en">The password of the user to be used for service calls to OSCM</LocalizedDescription>
      <LocalizedDescription locale="ja">OSCMのサービスを呼び出す際に利用する利用者のパスワード</LocalizedDescription>
    </ParameterDefinition>

    <ParameterDefinition configurable="true" default="ror([a-z0-9]){2,25}" id="INSTANCENAME_PATTERN"
      mandatory="true" valueType="STRING">
      <LocalizedDescription locale="en">Validation pattern for instance names (regex)</LocalizedDescription>
      <LocalizedDescription locale="ja">インスタンスの名前の妥当性を検証するためのパターン (正規表現)</LocalizedDescription>
    </ParameterDefinition>

    <ParameterDefinition configurable="true" default="ror" id="INSTANCENAME_PREFIX" mandatory="false"
      valueType="STRING">
      <LocalizedDescription locale="en">Prefix for the instance names (prepended automatically)</LocalizedDescription>
      <LocalizedDescription locale="ja">インスタンス名のプレフィックス (自動的に先頭に追加されます)</LocalizedDescription>
    </ParameterDefinition>

    <ParameterDefinition configurable="true" id="INSTANCENAME" mandatory="true" valueType="STRING">
      <LocalizedDescription locale="en">Virtual System Instance Name</LocalizedDescription>
      <LocalizedDescription locale="ja">仮想システムのインスタンス名</LocalizedDescription>
    </ParameterDefinition>

    <ParameterDefinition configurable="true" default="template-13c8ab3348d" id="SYSTEM_TEMPLATE_ID"
      mandatory="true" valueType="STRING">
      <LocalizedDescription locale="en">Virtual System Template ID</LocalizedDescription>
      <LocalizedDescription locale="ja">仮想システムのテンプレートID</LocalizedDescription>
    </ParameterDefinition>

    <ParameterDefinition configurable="true" default="image-13cedeaf7ed" id="MASTER_TEMPLATE_ID"
      mandatory="true" valueType="STRING">
      <LocalizedDescription locale="en">Master Virtual Server Template ID</LocalizedDescription>
      <LocalizedDescription locale="ja">マスター仮想サーバのテンプレートID</LocalizedDescription>
    </ParameterDefinition>

    <ParameterDefinition configurable="true" default="image-13c8a812d25" id="SLAVE_TEMPLATE_ID"
      mandatory="true" valueType="STRING">
      <LocalizedDescription locale="en">Slave Virtual Server Template ID</LocalizedDescription>
      <LocalizedDescription locale="ja">スレーブ仮想サーバのテンプレートID</LocalizedDescription>
    </ParameterDefinition>

    <ParameterDefinition configurable="true" default="2" id="CLUSTER_SIZE" mandatory="true"
      valueType="ENUMERATION">
      <Options>
        <Option id="2">
          <LocalizedOption locale="en">Minimum cluster (2-VM)</LocalizedOption>
          <LocalizedOption locale="ja">小規模のクラスター構成 (2 VM)</LocalizedOption>
        </Option>
        <Option id="4">
          <LocalizedOption locale="en">Medium cluster (4-VM)</LocalizedOption>
          <LocalizedOption locale="ja">中規模のクラスター構成 (4 VM)</LocalizedOption>
        </Option>
        <Option id="9">
          <LocalizedOption locale="en">Maximum cluster (9-VM)</LocalizedOption>
          <LocalizedOption locale="ja">大規模のクラスター構成 (9 VM)</LocalizedOption>
        </Option>
      </Options>
      <LocalizedDescription locale="en">Cluster Size</LocalizedDescription>
      <LocalizedDescription locale="ja">クラスターの規模</LocalizedDescription>
    </ParameterDefinition>

    <ParameterDefinition configurable="true" default="1" id="COUNT_CPU" mandatory="false" valueType="ENUMERATION">
      <Options>
        <Option id="1">
          <LocalizedOption locale="en">1-CPU</LocalizedOption>
          <LocalizedOption locale="ja">1個</LocalizedOption>
        </Option>
        <Option id="2">
          <LocalizedOption locale="en">2-CPU</LocalizedOption>
          <LocalizedOption locale="ja">2個</LocalizedOption>
        </Option>
        <Option id="4">
          <LocalizedOption locale="en">4-CPU</LocalizedOption>
          <LocalizedOption locale="ja">4個</LocalizedOption>
        </Option>
      </Options>
      <LocalizedDescription locale="en">CPU Count</LocalizedDescription>
      <LocalizedDescription locale="ja">CPU数</LocalizedDescription>
    </ParameterDefinition>

    <ParameterDefinition configurable="true" default="^mail.username^" id="MAIL_FOR_COMPLETION"
      mandatory="false" valueType="STRING">
      <LocalizedDescription locale="en">The address to which emails are to be sent that describe manual steps required to complete an operation. If you specify this parameter, the service controller interrupts the processing of each operation before its completion and waits for a notification about the execution of a manual action. Omit this parameter if you do not want to interrupt the processing.</LocalizedDescription>
      <LocalizedDescription locale="ja">操作を完了するために手動の手順が必要であることを知らせるemailの送信先メールアドレス。このパラメーターを指定すると、サービスコントロールは各操作の完了前に処理を中断して、手動の操作が終わったことを知らせる通知が届くまで待ちます。処理を中断したくない場合は、このパラメーターを省略してください。</LocalizedDescription>
    </ParameterDefinition>

    <ParameterDefinition configurable="true" default="^mail.username^" id="MAIL_FOR_NOTIFICATION"
      mandatory="false" valueType="STRING">
      <LocalizedDescription locale="en">The address to which emails are to be sent that notify service users or administrators of customer organizations about a successful modification of a virtual platform or server. Such modifications result from changes in the configuration parameters at a corresponding subscription.</LocalizedDescription>
      <LocalizedDescription locale="ja">仮想プラットフォームまたはサーバの更新に成功したことを知らせるemailの送信先メールアドレス。サービスの利用者またはサービス利用部門の管理者のメールアドレスを指定します。対応する購入済サービスのサービス設定のパラメータを変更したときに、仮想プラットフォームやサーバが更新されます。</LocalizedDescription>
    </ParameterDefinition>
  </tns:TechnicalService>
</tns:TechnicalServices>